p_name,author,p_year,abstract
17~19세기 몽골 불교사원의 다창 연구 -교육기관으로서의 기능을 중심으로-,김경나,2016,"본 연구의 목적은 16세기 말 티베트불교와 함께 몽골에 유입된 다창(Datsan)의 교육 및 사회사적 기능과 특징을 고찰하는 데에 있다. 몽골 불교사원에 부설된 다창은 17~19세기 몽골 지역 신앙을 기반으로 하며 몽골 전통 교육 체계의 큰 축을 담당하였다. 본 연구에서는 티베트에서 몽골로 유입된 다창의 설립배경과 확산 양상을 다양한 문헌 자료를 통해 실증적으로 분석하였으며, 특히 몽골 불교사원의 규모와 종류, 명칭, 조직구조에 대한 개설에서 나아가 각 층위에 대한 구체적 논의에 초점을 맞추었다. 또한 교육적 측면에서 몽골 다창과 티베트 다창의 동이(同異)점을 논의하고, 몽골의 불교사원?다창?승려 등에 대한 지역별 및 시대별 분포 변화, 몽골 불교사원에 부설된 대표적인 다창의 사례를 고찰하여 몽골 다창의 특수성을 논증하였다. 교육기관으로서의 기능을 중심으로 논의한 17~19세기 몽골 다창의 연구 결과는 다음과 같다. 첫째, 지금까지 종합적으로 연구되지 않았던 몽골 다창의 구조와 교육내용, 제도 및 그 변천 과정을 파악하였다. 아울러 교학 및 학위제도, 공통 교과과정과 논증 및 경론을 통한 학습방법에 대하여 고찰하였다. 둘째, 현존하는 문헌 자료를 수집하여 몽골 지역의 사원과 각 분과별 다창의 종류 및 지역별 분포를 시대별로 분석하였다. 이 과정을 통해 당시 투셰트 한 아이막(T?heet khan aimag) 지역에 사원과 분과별 다창이 가장 많이 위치하며, 이 지역이 몽골 불교의 핵심 지역이었음을 증명하였다.셋째, 다창의 교학제도에서는 일반 교육제도로서 교과과정과 학습방법, 학위제도를 티베트의 전형과 비교 고찰하였다. 또한 자생적 기반을 바탕으로 한 관학(官學)과 소규모 가정학습 위주의 전통적 유목사회 교육이 다창 설립을 통해 체계적인 ‘학교’로서의 교학시스템을 갖추어 변모하게 되었음을 조명하였다. 몽골 다창은 티베트 교학제도를 수용했지만, 19세기 이후 불교와 사원이 번영기를 누리면서 다창의 분과도 점차 세분화되었다. 그 중 조르하인 다창(Zurkhain datsan)은 천문과 역법, 번역, 음악, 공예, 연극 등 실용학문과 전통문화예술을 교육하여 다창이 종합학교로서의 기능을 구축하는 데 큰 역할을 했음을 확인하고, 티베트 다창의 양상과 차이점을 논의하였다. 넷째, 다창에서 필수적으로 교육된 학문 분과인 현종(顯宗), 밀종(密宗), 의학(醫學), 시륜(時輪), 천문(天文), 역법(曆法) 등의 주요 학습서와 교육 내용을 검토하였다. 이를 통해 다창에서의 교육은 17~19세기 몽골 불교사원에서 지속적인 발전과 함께 견고해졌음을 확인하였다. 다섯째, 다창의 학문 분과별 괄목할 성과를 남긴 사원의 역사와 다창의 역할을 분과별로 고찰하였다. 기존에 발표되었던 자료와 활불(活佛)들이 저술한 전기(傳記) 등을 통해 학문적 토대이자 몽골의 유·무형 문화유산의 집약체라는 측면에서 사원과 다창이 남긴 자취를 밝히고, 해당 지역 사원의 교육과 민중교화 기능에 주목하였다. 이러한 연구 과정을 통해 티베트불교와 함께 유입된 교육기관인 다창이 티베트의 전례와 달리 몽골화되는 시대별 변천양상을 검토하고, 몽골 현지화된 다창의 교육 내용과 지역적 분포, 학문분과별 특징을 고찰하였다. 아울러 17~19세기 교육기관이자 지식인 양성소로서 다창이 담당한 기능과, 여기서 배출된 몽골의 고승(高僧)과 활불(活佛)이 남긴 저작에 대해 검토하였다. 그 결과 티베트로부터의 일방적 전승이 아니라 몽골 토착문화의 발전과 외래문화의 몽골화가 함께 했음을 몽골 다창의 형성과 변천에 대한 논의를 통해 확인하였다. 다창은 정교한 조직 시스템과 완비된 제도에 힘입어 17세기 이후 몽골 문화권에 두루 확산되기 시작했고, 19세기에 들어서면서 최고 전성기를 맞이한다. 당시 사회적 조건과 몽골인의 굳건한 신앙심은 학문적 융성과 다창의 번영을 불러왔다. 몽골 다창은 티베트 불교 유입 이후 몽골사회의 구심점으로서 교육과 문화, 경제에 큰 영향력을 가지고 있었지만, 청대 위정자들의 대(對) 몽골 정책과 1930년대 사회주의 종교탄압 등 정치와 시대변화에 휩쓸릴 수밖에 없었던 한계점을 갖는다. 몽골 다창은 향후 동양교육사의 일부분으로서 각 학문분야별 교육에 대한 다양하고 심층적인 연구가 진행되어야 할 필요성이 있다. 뿐만 아니라 인접 국가들과의 비교연구를 통해 다창과 몽골 불교사원의 전개양상을 종합적으로 고찰하는 일 역시 장기적인 논제로 남아있다. 17~19세기 몽골 다창에 대한 본 연구는 국내에서 처음으로 논의한바 향후 티베트불교 문화권의 각 민족과 지역의 문화를 비교 연구하는데 단초가 될 것이다.문제중심학습"
대학교육기관 서비스품질에 대한 몽골과 일본의 경쟁모델 비교,강만수,2011,"동아시아는 같은 사상을 영향을 받아 교육에서도 유사한 점을 가지고 있으나, 경제적 성장이나 역사를 통해 이질적인 문화를 배경으로 교육정책이 변화해왔다. 이와 같은 관점에서, 동아시아에 위치한 국가의 대학은 발전을 위해서 수요자 중심적 사고를 바탕으로 학생들에게 최대한의 서비스를 제공하는 것이 중요할 것이다. 따라서 대학들은 수요자인 학생들을 위하여 양질의 교육서비스를 제공하고 학생만족을 바탕으로 명성(대학이미지)을 구축하여 대학의 경쟁력을 배양하는 것이 중요하다. 본 연구의 목적은 몽골과 일본대학들의 교육서비스품질을 바탕으로 한 가치모델, 만족모델, 간접모델, 연구모델의 4가지 경쟁모델을 제안하고, 몽골과 일본대학들에 가장적합한 모델을 찾고자 하였다. 직원품질 즉, 교육서비스품질이 사회가치 즉, 지각된 서비스가치와 학생만족, 명성 및 충성도에 어떠한 영향을 주는지에 대해 가치모델(Value Model), 만족모델(Satisfaction Model), 간접모델(Indirect Model), 연구모델(Research Model)의 4가지 모델로 구분하였다. 4개의 경쟁모델의 분석결과, 몽골과 일본대학들의 가장 적합한 모델로 본 연구가 제시하는 연구모델이 채택되었다. 본 연구의 결과는 몽골과 일본대학들에게 적합한 모델을 제시하여, 각각 국가의 대학들에 적합한 모델을 찾는데 도움을 주고 적합한 모델에 적절한 전략을 수립하는데 유용한 시사점을 제공하고자 한다.문제중심학습"
몽골 대학들의 한국어 교육,권성훈,2009,"본고에서는 몽골 대학들에서 이루어지고 있는 한국어 교육에 대한 전반적인 현황과 문제점에 대해 다루었다. 몽골에서는 1991년 10월에 최초로 몽골 국립대학교에 한국어과가 개설되어 본격적으로 한국어 교육을 시작했다. 뒤를 이어 외국어대학교(1992)와 국립 울란바타르대학교(1994), 사립 울란바타르대학교(1995), 국립 사범대학교(2000) 등에 한국어과가 개설되었다. 그 수는 꾸준히 늘어 2009년 현재 몽골의 25개 대학에서 한국어를 가르치고 있다. 그 중에서 정식으로 학과(한국어과 또는 한국학과)가 개설된 대학은 19곳에 이른다. 몽골 대학들의 한국어 교과과정을 보면, 대체적으로 1,2학년에는 회화, 문법, 어휘 과목이, 3,4학년에는 한-몽, 몽-한 번역 및 한국학의 주요 과목이 배정되어 있다. 2000년 이후 몽골 대학에서의 한국어 교육에 나타난 가장 큰 변화 중 하나는 몽골인 교수들의 약진이다. 1990년대 초에는 주로 한국인 유학생들과 KOICA 단원들이 한국어 교육을 담당했다. 몽골인 교수의 숫자는 손에 꼽을 정도였다. 그러나 현재 몽골 대학에서 가르치는 한국어 교수의 숫자는 몽골인이 63명, 한국인이 45명으로 몽골인의 수가 훨씬 더 많다. 한국어 교재 개발 및 출판에 있어서도 몽골인 교수들의 약진이 두드러진다. 2000년 이전에는 한국인 교수들이 교재 개발을 주도했다면, 현재는 몽골인 교수들이 주도하고 있다. 또 다른 변화는 몽골 대학들이 한국어과에서 한국학과로의 전환을 모색하고 있다는 것이다. 이는 학생들에게 한국의 언어 뿐 아니라, 정치, 경제, 문화, 역사, 과학ㆍ기술 등 다양한 전공의 기회를 제공하기 위함이다. 실제로 한국어를 전공한 학생들은 대학원을 진학할 때 한국어문학이나 한국어 교육을 주로 선택하는 경향이 있는데, 한국학 전공자는 전공 선택의 폭이 다양하다. 이런 이유에서 몽골 국립대학교와 인문대학교의 한국어과가 각각 1994년과 2003년에 한국학과로 개명했으며, 사립 울란바타르대학교는 2003년에 한국어과와는 별도로 한국학과를 설치해 운영하고 있다. 몽골 대학들의 한국어 교육의 문제점은 각 대학 한국어과들 간의 교육수준 편차의 심화, 경험 있는 한국인 교수의 부족, 교과과정의 비현실성, 제한적인 한국어 교수방법의 적용, 교재개발에 있어서 전문가들 간의 협력부족 등을 들 수 있다. 이상의 문제점들을 개선하고, 한국과 몽골 양국 정부와 기업인들이 노력하여 한국어의 사회적 수요를 지속적으로 창출해 나간다면 한국어는 몽골에서 각광받는 제2 외국어가 될 것이다.문제중심학습"
17~18세기 몽골전통의학 교육기관 만바다창 연구,"김경나, 이성규",2015,"본고는 17~18세기 몽골 불교사원에 설치되었던 전통의학 교육기관인 만바다창의 설립 배경과 교육제도의 특징을 밝히는 데에 목적을 두었다. 몽골의 만바다창은 전문적인 의학교육을 통해 醫僧 배출과 의학 연구, 진료를 함께 담당하였던 당시 몽골의 종합 의료 기관이었다. 본고에서는 몽골 만바다창의 설립 배경과 의의를 밝히고, 몽골의 의승들이 만바다창의 교육을 체계화시키기위해 저술하였던 몽의서들을 참고서와 교재, 지침서로 분류하여 설명하였다. 또한 6~7세부터 20여 년 이상 지속되는 만바다창의 전문의학 학습제도와 학승들의 출신 배경, 시험 및 학위 수여제도를 논의하였다. 몽골에는 17~18세기 불교 사원을 통해 티베트 의학이 유입되었으며, 몽골인들은 그 의학 체계에 몽골의 민간요법과 약재들을 적용하여 몽골인들에게 적합한 치료법으로 발전시켰다. 몽골 만바다창의 교육제도 또한 티베트와 변별성이 있음을 본고의 논의를 통하여 확인하였다. 국내에 소개되지 않은 몽골전통의학에 대한 사적 소개를 시도하였다는 점에서 본 연구의 의의를 두고자 한다. 몽골의 전통의료교육기관이었던 만바다창의 교육제도를 살펴보는 작업은, 당시 몽골의 醫學史 뿐만 아니라 몽골 불교사원이 가지던 기능, 몽골 전통교육제도의 단면을 고찰할 수 있다는 점에서 그 가치를 찾을 수 있다.문제중심학습"
몽골 전통교육기관 다창(Datsan)의 교육철학과 교수법 연구,"김경나, 최영준",2016,"본 연구는 몽골 전통교육기관인 다창(Datsan)의 교육철학과 목적, 교수법을 고(故) 문서 및 문헌 조사와 자료 분석 그리고 선행연구 내용분석을 통해 고찰하여 동양의 교육문화를 규명하고 이해하는 데 그 목적이 있다. 몽골 불교사원 내에 설립된 다창은 승려들이 학문을 깊이 연구하고 오부대론(五部大論)의 내용에 정통하여 불교의 본질적인 정신을 이해하도록 하는 것이 교수철학이자 목표였다. 16세기 후반 몽골지역에 설립되기 시작한 다창은 18-19세기에 몽골 전역에 퍼지면서 불교적 지식과 교양함양 뿐만 아니라 언어와 과학, 예술 및 종합학문을 함께 가르치는 곳이었으며, 직업교육 기관이자 평생교육기관으로서의 역할도 함께 수행했다. 몽골 다창의 주요 교수법은 기본적으로 경전에 대한 암송과 논쟁, 문답식 변론, 의학분과의 임상 및 체험학습, 천문·역법분과의 탐구 교수법으로 크게 나누어 볼 수 있다. 다창 교수법 중 가장 두드러지는 것은 귀류 논증법에 의거한 논쟁(論爭) 수업으로, 학습하는 승려의 지적 단계를 높이기 위한 훈련이자 난해한 불교철학을 이해하는데에 필수적인 과정이다. 몽골 다창의 학승들은 이러한 논증과 토론학습 방법을 통해 표현 능력과 논리력을 단련하였다. 논쟁 교수법의 연장인 변론(辯論)은 질의응답 과정을 통해 사고력을 신장시켰다. 체험학습은 의학다창에서 집중적으로 이루어졌다. 의학다창의 학생들은 몽골 전통의학의 기초 지식 숙지는 물론, 약초 감별 및 채취법, 조제법과 임상 훈련을 받아야 했다. 탐구 교수법은 천문·역법 다창을 위주로 진행되었다. 별자리의 이동을 활용하여 시간을 측정하고, 몽골력(蒙古曆) 제작을 통해 절기와 계절, 유목 생활의 기준이 되도록 하였다. 다창의 교수법은 학습 내용을 논쟁과 문답수업으로 완전히 체득하도록 하고, 체험과 탐구 교수법을 통해 학문과 실체를 모두 익히도록 체계화되었다. 아울러 다창의 학습체계를 통해 실용학문의 전문적 지식 습득을 통한 직업교육과 시민교육이 17~19세기 동양에서도 실시되었다는 점을 확인할 수 있다.문제중심학습"
17~19세기 몽골 불교사원의 교육문화 연구,"김경나, 최영준",2017,"본 연구는 몽골 현지 조사 및 문헌 수집 자료를 중심으로 17∼19세기 몽골의 교육기관으로 불교사원이 형성된 사회사적 배경을 설명하고, 몽골 지역의 불교사원 확산으로 인한 학승계층의 확대와 교육체계의 변화를 고찰하며, 몽골 불교사원 교육기관의 교육내용과 교육체계, 교육목적을 분석하여, 그 교육문화의 특징을 논의하는 데에 그 목적이 있다. 연구의 주요 연구방법으로는 몽골 불교사원의 교육문화 고증에 관련된 고문서의 해석본과 관련 문헌들의 내용분석을 실시하였고, 몽골현지 불교사원의 자료를 해석하였다. 연구결과 첫째, 몽골 불교사원은 몽골 전 지역을 담당하는 거국적인 교육기관으로서 자리하고 있었다. 둘째, 몽골 불교사원은 교육기관으로서 오늘날의 교육과정과 학과과목을 비교해도 손색이 없었다. 셋째, 몽골의 불교사원은 다양한 교수법으로 학승들의 교육을 체계화시키고, 학습효율을 제고하였다. 넷째, 몽골 불교사원의 교육목적이 학문적 정진 외에 지역사회 내에서 교양과 관혼상제, 생활의례를 익히는 것도 포함하고 있었다. 다섯째, 몽골의 불교사원을 통한 교육은 몽골인의 정신문화 수호에도 일익을 담당하고 있었다.문제중심학습"
몽골 불교사원의 교육 철학-불교사원 내의 `Datsan`의 교육 철학을 중심으로,"김경나, 박금주, 최영준",2018,"본 연구는 몽골 전통교육기관인 다창의 교육철학 및 그 문화를 이해하고 고찰하는 데 그 목적이 있다. 몽골 불교사원 내에 설립된 다창에서는 승려들이 학문 탐구와 교리에 정통하여 불교의 본질을 깨닫게 하는 것이 기본적인 교육 목표이자 철학이었다. 16세기 후반 몽골지역에 세워지기 시작한 다창은 18~19세기에 몽골 전 지역에 확산되면서 불교 교리와 교양, 외국어와 과학, 예술, 의학 등 종합학문을 교육한 공간이었으며, 직업교육과 평생교육을 함께 담당하였다. 몽골 다창의 주요 교육 철학은 인문주의, 행동주의, 인본주의 및 다문화주의 성격으로 크게 나누어 볼 수 있다. 인문주의 접근으로는 교사 역할의 절대적 역할과 경전을 통한 진리탐구 및 이해를 필수적인 과정으로 볼 수 있다. 또한 행동주의 특성으로는 다창의 엄격한 책무성과 개인의 진로 및 능력을 고려한 차등 교육을 들 수 있다. 인본주의 사고로는 불교 교육의 궁극적 목표인 중생구제와 자아 탐색의 철학이 두드러지는 것을 확인하였다. 또한 다문화주의 성격으로는, 18~19세기 단일 민족의 한계를 극복할 수 있는 창구로서 몽골 다창이 교육적 통로의 큰 역할을 했다는 것이다. 아울러 다창의 학습체계를 통해 불교 철학과 인문주의적 자아실현 및 전문 지식 습득을 통한 교육이 17~19세기 몽골에서 실시되었다는 점을 확인하였다.문제중심학습"
몽골인 한국어 학습자를 위한 현대몽골어와 한국어의 피동 대조 연구,김기성,2017,"본 연구는 현대몽골어의 ‘피동(被動, passive)’에 대한 유형 및 구성, 그의 의미, 기능 등을 정리해 살펴보고, 이후 이를 기준으로 여기에 대응 가능한 한국어 ‘피동’과 서로 대조 분석해 보았다. 또한 이러한 대조 분석을 통해 이들이 서로 어떠한 유사점과 차이점 등을 갖고 있는지 살펴보며, 현대몽골어와 한국어 두 언어의 학습자들에게 담화, 문맥 등의 상황에서 매우 중요하게 나타나는 피동의 올바른 사용법과 이를 위한 기초자료 등을 함께 제시해 보았다. 현대몽골어와 한국어의 피동은 행위를 누가 수행했는지를 가리키는 것이 아니라 무엇이(어떤 행위가) 수행되었는지를 가리키며, 능동 행위주는 여 · 처격어미 ‘-д/т’몽골어), ‘에게, -에 의해(서)’한국어)로 구성된다는 유사점을 갖는다. 한편, 한국어의 피동(피동 표현, 피동법)은 일반적으로 1)‘되다’ ‘당하다’와 같은 어휘를 써서 피동문을 만드는 방식인 ‘어휘적 피동’ 2)‘이-, -히-, -리-, -기-’와 같은 파생접미사를 동사 뒤에 붙이고, 목적어를 주어로 그리고 주어를 ‘-에게, -에 의해(서)’형태의 부사(부사어)로 바꾸는 방식인 ‘파생적 피동’ 3)‘아/어지다, -게 되다’와 같은 통사적 구성 형태를 동사 뒤에 붙여서 피동문을 만드는 방식인 ‘통사적 피동’등으로 비교적 세분화되어 있는 반면에 현대몽골어의 피동은 ‘-гд, -д, -т’와 같은 형태의 피동 접사를 동사의 어간에 연결해 피동의 의미를 표현하는 파생적 피동이 일반적이다. 따라서 한국어에 비해 상대적으로 다양하지 못하다는 차이점을 갖는다.문제중심학습"
몽골인 한국어 학습자를 위한 현대몽골어와 한국어의 사동 대조 연구,김기성,2019,"본 연구에서는 현대몽골어의 태(態, хэв, voice) 체계 속에서 ‘사동(使動, causative)’에 대한 유형 및 구성, 또한 그의 의미, 기능, 용법 등을 정리해 살펴보고, 이후 이를 기준으로 여기에 대응 가능한 한국어 ‘사동’과 서로 대조 분석해 보았다. 아울러 이러한 대조를 통해 이들이 서로 어떠한 유사점과 차이점 등을 갖고 있는지 살펴보았으며, 양 언어의 학습자들에게 담화, 문맥 등의 상황에서 매우 중요하게 나타나는 사동의 올바른 사용법과 이를 위한 기초자료 등을 제시해 보았다. 현대몽골어와 한국어 모두 자동사, 타동사 어느 것에나 사동 접사(몽골어: ‘-уул2’, ‘-лга4’, ‘-га4’, ‘-аа4’, 한국어: ‘-이-’, ‘-히-’, ‘-리-’, ‘-기-’, ‘-우-’, ‘-구-’, ‘-추-’, ‘-시-’, ‘-으키-’ 등)를 연결해 타동사 사동을 만든다. 이러한 파생적 사동이 일반 보편적이다. 현대몽골어와 한국어의 사동은 일반적으로 활용 방법 면에서 유사한 면을 보인다. 자동사에서 파생된 사동(사동문)의 경우 능동문의 주어는 사동문의 목적어가 되고, 새로운 주어가 들어가(나타나) 사용된다. 능동문의 주어가 사동문의 목적어가 되면서 목적격 어미(몽골어：‘-ыг/ийг, -г, 목적격 의미의 ø’, 한국어：‘-을/를, 목적격 의미의 ø’)를 취하게 된다. 타동사에서 파생된 사동(사동문)의 경우 능동문의 주어는 사동문의 부사어가 되며, 새로운 주어가 들어가(나타나) 사용된다. 능동문의 주어가 사동문의 부사어가 되면서 여·처격 어미(몽골어：‘-д/т’, 한국어：‘-에게/-한테, -께/’)나 또는 도구격 어미(몽골어：‘-аар4’, 한국어：‘-로(-로 하여금)’를 취하게 된다. 한국어의 사동(사동 표현, 사동법)은 일반적으로 1) ‘시키다’와 같은 어휘를 써서 사동문을 만드는 방식인 ‘어휘적 사동’, 2) ‘-이-, -히-, -리-, -기-, -우-, -구-, -추-, -애-, -시-, -으키-’ 등과 같은 파생접미사를 동사 뒤에 붙이고, 능동문의 주어를 목적어 또는 ‘-에게/한테/께’ 형태의 부사(부사어)로 바꾸며, 새 주어를 도입함으로써 사동문을 만드는 ‘파생적 사동’, 3) ‘-게 하다/만들다, -도록 하다/만들다’와 같은 통사적 구성을 동사 뒤에 붙이고, 새로운 주어를 도입함으로써 사동문을 만드는 방식인 ‘통사적 사동’ 등으로 비교적 세분화되어 있는 반면, 현대 몽골어의 사동은 ‘-уул2, -лга4, -га4, -аа4’와 같은 형태의 사동 접사를 동사의 어간에 연결해 사동의 의미를 표현하는 파생적 사동이 일반적이다. 따라서 한국어에 비해 상대적으로 다양하지 못하다는 차이점을 갖는다.문제중심학습"
몽골의 한국어 교육과정에 대한 일고찰 -목적에 따른 영역 별 교과목 관계를 중심으로-,김명광,2008,"이 글은 한국어 교수-학습의 지향 목표를 거시적으로 분류하였을 때 나타나는 상위 영역 항목과 각 상위 영역에 포함되는 개별 교과목들의 범주와 각 영역의 교과목 시수를 통하여, 몽골의 한국어 교육과정 구성 요소 간 유기적 상관관계를 살펴보는 데 목적이 있다. 한국어 영역은 교수-학습 지향점에 따라 크게 ‘언어 사용 가능, 문법, 문학, 문화, 실용, 교육, 기타’ 등으로 나뉘며 이는 다시 각 영역에서 지향하는 목표에 따라 세부적인 교과목 영역으로 분류된다. 몽골의 각 대학교는 대게 ‘한국어 문법’과 ‘언어 사용 기능 영역’을 강조하지만, 그 외의 영역은 각 대학교의 교육 의도에 따라 상호 비중이 다르게 편성된다.문제중심학습"
