p_name,author,p_year,abstract
학습 환경에 따른 몽골인 한국어 학습자의 요청 화행 연구,"TSEDENJAV, BAYARMAA",2016,"본 연구는 몽골인 한국어 학습자의 한국어 요청 화행(requests) 전략 양상을 고찰하는 데 목적을 두었다. 이를 위하여 몽골인 학습자는 학습 환경 요인에 따른 두 집단으로 설정하였다. 다시 말하면 몽골에서 한국어를 배우는 학습자(KFL)하고 한국에서 한국어를 배우는 학습자(KSL) 간의 한국어 요청 화행 전략 양상에서 나타나는 유사점과 차이점을 밝혀 그것을 한국인과 몽골인 모국어 화자와 비교함으로써 학습 환경이 학습자의 화행 전략에 어떠한 영향을 미치는지를 분석하고자 하였다. 그간의 한국어 학습자의 중간언어 화용론(interlanguage pragmatic)에 관한 연구들은 영어권, 중국어권, 일본어권 학습자를 주로 대상으로 한 것에 비하여 몽골인 한국어 학습자는 비교적 많은 관심을 받지 못한 편이다. 또한 몽골에서 한국어를 배우는 학습자의 한국어 화용 습득과 인식 또는 전략에 관한 연구가 아직 없다. 이에 본 연구는 한국인과 몽골인 모국어 화자의 요청 전략을 고찰한 후, 서로 상이한 학습 환경에 노출되어 있는 몽골인 학습자 두 집단의 전략을 분석하면서 몽골인 학습자 두 집단의 전략이 그들과 비교하였을 때 어떤 차이가 있고, 그 차이점이 어떠한 양
상으로 실현되는지를 밝히고자 하였다. 이를 위하여 선행연구 및 요청 상황 적절성 조사를 통하여 설정한 12가지 상황에서 타난 실현된 네 집단의 요청 화행 응답을 본 요청과 보조 요청 전략으로 구분하여 분석하였으며, SPSS18.0을 활용하여 그 차이점이 통계적으로 유의한지를 검증하였다. 본 연구의 구성은 다음과 같다. Ⅰ장에서는 연구의 목적을 제시한 후 선행연구를 검토하였다. 요청 화행하고 학습 환경, 한국어 또는 몽골어 요청 화행 전략에 관한 선행연구를 비판하면서 본 연구의 필요성을 도출하고자 하였다. 한국어 학습자의 화행 전략 양상을 밝힌 연구가 활발히 이루어졌음에도 불구하고 몽골인 한국어 학습자를 대상으로 한 연구가 매우 미흡하며, 특히 몽골에서 한국어를 학습하는 학습자의 화용론 능력에 관한 연구는 아직 없는 것으로 확인되었다. 본 장의 마지막으로 본 연구의 연구문제를 설정하여 그에 관한 근거를 밝혔다. Ⅱ장에서는 본 연구의 이론적 배경을 고찰하였다. 먼저 화행 이론과 요청 화행 정의 및 특징을 살피면서 본 연구의 요청 화행 정의와 범주를 제시하였다. 그리고 학습 환경 요인에 관하여 한국어가 외국어 또는 제2언어로서의 특징을 밝혔다. 이어서 한국어와 몽골어 요청 화행 전략의 특징을 밝힘으로써 두 언어 간의 차이를 알아보았다. 그간의 한국어 학습자의 요청 화행 전략 양상을 살핀 연구들이 학습자에 언어 전략에 나타나는 모국어의 영향을 분석하기 위하여 모국어 화자의 전략 양상을 많이 다루었다. 그러나 모국어 화자의 전략 양상 분석 유형을 자세히 제시하지 않아 정확한 모국어 영향 고찰이 이루어지지 않았다. 따라서 연구 결과에서도 한국인 모국어 화자와의 차이점을 밝혔으나 모국어로서의 영향에 관한 구체적인 분석을 하지 못 한 바 있다. 이에 본 연구는 몽골인 모국어 화자의 요청 전략 양상을 자세히 다루고 학습자의 전략 양상에 나타나는 모국어의 구체적인 영향을 제시하고자 하였다. Ⅲ장에서는 연구 방법에 대하여 자세히 기술하였다. 연구절차 및 자료 수집 도구, 피험자 정보, 본 요청과 보조 요청 전략 분석 유형을 자세히 소개하였다. 예비실험을 앞서 요청 상황의 실제성 여부를 확인하기 위하여 상황 적절성 조사를 실시하여 실제성이 없거나 낮은 상황을 삭제하거나 수정·보완하였다. 이러한 12개의 요청 상황으로 구성된 서면 DCT를 활용하여 예비실험을 실시하였다. 예비실험에서 발생한 집단별 문제점과 그에 관한 해결점을 밝힌 후 그를 토대로 본 실험을 실시하였다. 본 실험 결과와 요청 전략 양상을 밝힌 그간의 선행연구를 참고하여 본 연구의 요청 분석 유형을 도출하면서 거기에 해당되는 한국어 또는 몽골어 전략 표현을 구체적으로 정리하였다. 피험자들의 전략 유형을 코딩할 때 연구자 본인뿐 아니라 한국어 교육 전문하가와 몽골어교육 전문가의 논의를 거쳐 그 신뢰성 및 정확성을 높이고자 하였다.
Ⅳ장에서는 본 실험을 통하여 수집한 네 집단의 피험자들의 본 요청과 보조 요청 전략 양상을 한국인과 몽골인 모국어 화자 간의 차이, KFL과 KSL 집단 간의 요청 전략 차이를 고찰하면서 각 분석에서 나타난 피험자들의 특징을 질적으로 분석하였다. 또한 그 차이가 통계적으로 유의미한지를 카이스퀘어 검정을 통하여 검증하였다. 각 변인에 따른 집단 간의 차이를 밝히면서 이러한 사회적 변인이 요청 전략 양상에 어떠한 영향을 미치는지를 알아보았다. 분석 결과를 각 연구문제에 따라 정리하면 다음과 같다. 첫째, 연구문제1인 한국인과 몽골인 모국어 화자 간의 요청 전략 양상에 나타나는 특징은 한국인 모국어 화자는 본 요청 화행을 비교적 간접적은 전략으로 수행하되 가장 명시적이고 직설적인 명령형 전략을 매우 적극적으로 사용한 것이었다. 그 반면에 몽골인 모국어 화자는 한국어의‘-았/었/였으면 좋겠어요’에 해당되는 희망형 전략을 가장 선호하였다. 또한 명령형과 의무형을 제외한 나머지 직접적인 전략에서 MNS 집단이 가장 높은 빈도를 보여 준 것도 몽골어 요청 화행의 직접적인 전략 표현도‘guimaar baina, guij baina, guix gesen yum/yum baina, guix geel, guix l gej, guix sanaatai/bodoltoi' 등의 수행동사와‘guilt, guix ym, guilga, guivar, x?selt, x?sex yum' 등의 수행명사로 다양하게 이루어지는 것과 관계가 있는 것으로 나타났다. 간접적인 전략에서 KNS 집단은 화자가 청자의 의지 또는 의도를 묻는 의지형을, MNS 집단은 화자가 청자의 화행 수행 능력을 묻는 능력형을 선호하였고, 화자가 청자 스스로가 요청 화행 수행을 파악하도록 표현하는 추론형 전략을 KNS 집단이 빈번히 사용한 반면에 MNS 집단은 가장 낮은 빈도를 보여주었다. 둘째, 연구문제2인 KFL과 KSL 집단의 요청 전략에 나타나는 특징은 KFL과 KSL 집단은 본 요청 전략을 전체적으로 간접적인 표현보다 직접적인 표현을 조금 더 선호하였으나 그 수치가 높지 않았다. 그러나 KFL 집단은 직접적인 표현인 명령형과 의무형 전략을 나머지 세 집단 집단보다 훨씬 더 많이 사용하였으며, 특히 명령형 빈도는 MNS 집단의 빈도보다 2.3배가 높은 수치를 보였다. 따라서 KFL 집단은 KSL과 KNS 집단과 비교하였을 때 요청 화행 사용에서 직접적인 전략을 보다 선호한 것을 알 수 있었다. 그 반면에, KSL 집단은 직접적과 간접적 전략을 서로 비슷하게 사용하고 있으며, 직접적인 전략 중 명령형을 가장 선호하였다. 또한 KSL 집단은 KNS 집단과 마찬가지로 본요청 화행의 간접적인 전략 중‘-아/어 줄래?/주시겠어요?’와 같은 의지형을, KFL 집단은‘-아/어도 돼요?, -(으)면 안 될까요?’와 같은 허락형을 가장 선호하였다. 그러나 몽골인 학습자 두 집단 중 특히 KFL 집단이 허락형 전략을 KNS 집단이 주로 사용한‘-아/어도 돼요/될까요?’와 같은 양보 의미가 강한 문형보다‘-(으)면 돼요/될까요?’와 같은 조건 의미가 강한 문형을 보다 많이 사용하는 것으로 나타났으며, 이것은 몽골어의 요청 화행 전략의 대표적인 특징인‘-bal/val⁴zereg n?xc?lt b?tectei(-(으)면 와 같은 조건형으로 구성됨)’과 관계가 있는 것으로 본다. 따라서 한국에 체류하는 몽골인 학습자의 요청 전략 양상은 한국인 모국어 화자와 비슷한 반면, 몽골에 체류하는 몽골인 학습자는 보다 직설적이며 명시적인 양상을 보였다. 그러나 몽골인 학습자 집단 모두가 한국어 요청 화행을 실현하는 전략 표현에 있어서는 모국어인 몽골어의 영향을 적지 않게 받고 있음을 발견하였다. 그러나 요청의 보조 전략에 있어서는 두 집단 간의 차이는 그다지 크지 않은 것으로 나타났으며, 이것은 몽골인 학습자는 요청 화행을 실현할 때 익숙한 하나의 보조 전략을 사용하거나 아니면 잘 사용하지 않는 결과로 보인다.
마지막 Ⅴ장에서는 Ⅳ장에서 제시한 요청 전략 분석 결과를 종합하면서 정리하였다. 또한 본 연구가 가지는 의의와 제한점을 제시하였다. 지금까지 한국어 학습자의 요청 화행 전략 양상을 살핀 연구가 활발히 이루어졌으나 몽골인 학습자를 대상으로 한 연구는 매우 미흡하다. 또한 몽골에서 한국어 학습하는 학습자의 화용론적 능력을 분석한 논의가 아직 없는 것으로 확인되어 몽골인 한국어 학습자의 화용론 연구가 절실한 것으로 확인되었다. 이에 본 연구는 서로 상이한 학습 환경에 노출되어 있는 몽골인 학습자의 요청 화행 전략을 살핌으로써 몽골인 한국어 학습자뿐만 아니라 몽골어 또는 몽골어를 학습하는 외국인 학습자의 화행 연구의 토대가 될 것으로 기대된다. 본 연구를 시작으로 몽골인 한국어 학습자의 화행뿐만 아니라 몽골에서의 외 국어 화용론 연구 더 나아가 몽골인을 위한 한국어 교육 현장에 교육 자료가될 수 있다는 면에서 그 의의가 클 것이다.문제중심학습"
"몽골인 학습자를 위한 한국어 조사 교육 연구 -‘이/가’, ‘은/는’, ‘을/를’을 중심으로-",U. Bolor-Erdene,2017,"본고는 몽골인 학습자의 조사 ‘이/가’, ‘은/는’, ‘을/를’에 대한 사용 오류 양상을 통사·화용의 전반적인 측면에서 검토함으로써 오류 양상 및 원인을 살펴보고 이에 따른 효과적인 조사 교육 방안을 구축하는 것을 목적으로 하였다. 한국어와 몽골어는 알타이어계에 속하는 교착어로서 문법적으로 유사한 점을 많이 지니고 있어 몽골인 학습자들은 타 언어권 학습자들에 비해 한 국어 학습 속도가 빠르고, 문법 오류의 수도 적은 편이다. 그러나 학습자들은 한국어 조사 사용 시 잦은 오류를 범하는 양상을 보이는데 이는 ‘이/가’, ‘은/는’, ‘을/를’의 사용에서 더욱 두드러지게 나타난다. ‘이/가’, ‘은/는’, ‘을/를’은 한국어 학습의 초급단계에서부터 제시되는 가장 기본적인 문법 요소이지만 격조사적인 성격과 보조사적인 성격을 동시에 지닌 복잡한 문법 항목으로 외국인 학습자들이 학습하는 데에 어려움이 따른다. 실제 의사소통에서 ‘이/가’와 ‘을/를’은 체언뿐만 아니라 부사어, 보조적 연결 어미, 보조사 등의 다양한 구성 뒤에 실현되어 화용적 기능을 나타내고, ‘은/는’도 담화·맥락에 따라 대조 및 주제, 강조, 구정보의 의미 기능을 하는데 이러한 내용은 몽골 내 한국어교육에서 거의 다루어지지 않고 있다. 또한 현재 몽골 내 한국어교육에서 사용하는 학습 교재에서 ‘이/가’, ‘은/는’, ‘을/를’의 제시 순서 및 설명은 외국인을 위한 문법교육의 위계화 기준 즉, 난이도 및 사용빈도, 학습자의 특성 등 다양한 기준에 부합하지 못한 것이 대부분이다. 교육 내용 또한 ‘이/가’, ‘은/는’, ‘을/를’의 격 표지 기능 및 접속사로의 분류에만 집중되어 있어 실제 의사소통에서 모어 화자들이 많이 사용하는 화용적 기능에 대한 학습은 충분히 이루어지지 않고 있다. 즉, 현재 몽골인 학습자의 문법 지식 향상과 동시에 의사소통 능력 신장을 위해 ‘이/가’, ‘은/는’, ‘을/를’에 대한 기존의 형태·통사적 측면에서의 교육을 넘어 담화 맥락을 고려한 화용 층위에서의 교육이 요구되는 시점이라 할 수 있다. 이에 본고는 몽골인 학습자의 ‘이/가’, ‘은/는’, ‘을/를’에 대한 사용 오류 양상을 통사·화용의 전반적인 측면에서 검토함으로써 오류 양상 및 원인을 살펴보고, 이에 따른 교육적 처치로 형태 초점에 따른 통사 기능 교육 방법과 담화 맥락에 따른 화용 기능 교육 방법을 제시하기 위하여 다음과 같이 논의를 전개하였다. 먼저 본고의 연구 목적을 설정하고, 선행 연구 및 연구 대상, 연구 방법을 기술하였다. 다음으로 ‘이/가’, ‘은/는’, ‘을/를’의 조사 교육 연구를 위한 이론적 전제로서 ‘이/가’, ‘은/는’, ‘을/를’의 개념 및 통사·화용 층위에서의 기능 분류를 몽골어의 해당 문법 형태와 비교하여 그 차이점과 유사점을 밝혔다. 그리고 몽골의 주요 4개 대학의 한국어교육 커리큘럼 및 현재 사용하고 있는 한국어 교재 6종의 분석을 통해 문법 교육의 문제점을 조사를 중심으로 검토하였다. 또한 몽골인 학습자의 조사 사용 양상을 알아보기 위해 170명의 학습자를 대상으로 조사 항목에 대한 문법성 판단 테스트를 실시하여 ‘이/가’, ‘은/는’, ‘을/를’의 사용 오류 양상 및 원인을 알아보았다. 더욱 심도 있는 분석을 위하여 모어 화자와 몽골인 학습자가 작성한 총 16,591어절의 작문 자료를 대상으로 ‘이/가’, ‘은/는’, ‘을/를’의 사용 빈도 및 오류 양상을 분석한 후 몽골인 학습자 22명을 대상으로 심층 면접을 진행하여 몽골 내 한국어교육에서의 조사 교육의 문제점과 통사·화용 층위에서의 ‘이/가’, ‘은/는’, ‘을/를’의 기능에 대한 학습자의 이해도 및 지식 정도를 확인하였다. 다음으로 조사 사용 오류 양상의 분석 결과를 토대로 몽골인 학습자의 조사 사용 능력 신장을 위해 한국어 조사의 다양한 기능 즉, 통사적 기능과 화용적 기능을 함께 배울 수 있는 교육 내용의 위계화를 설정하고, 이에 따른 교육 방법을 구축하였다. 본 연구는 한국어의 대표적인 구조격 조사 ‘이/가’, ‘을/를’과 보조사 ‘은/는’의 통사·화용 기능에 초점을 맞추어 몽골인 학습자와 모어 화자의 실제 사용 양상을 바탕으로 오류 양상 및 원인을 분석하고, 이에 적합한 교육 내용 및 방법을 구축하였다는 점에서 의의가 있다.문제중심학습"
몽골인 학습자를 위한 한국어 유의어 교육 방안 연구 -TV 방송 프로그램 활용을 중심으로-,Z. Erdenesuren,2014,"몽골은 70년 동안 사회주의 국가로 발전해 왔으나 새로운 시스템, 즉 민주주의가 도입되어 세계의 자유 시장으로 향하게 된 1990년 이후에는 커다란 변화가 생기기 시작하였다. 세계화가 되어 가는 몽골은 모든 분야에서 여러 국가들과 활발한 협력 관계를 확대해 나가고 있다. 특히 몽골과 한국의 역사를 보면 예로부터 협력 관계를 맺어 왔다는 것을 알 수 있으며 최근 들어 더욱 활발히 우호 관계를 발전시키고 있다. 몽골에서 한국에 대한 관심이 높아지고 몽골에 한국기업 및 기관, 단체들이 활발히 진출하면서 전문적으로 한국학 및 한국어를 배우고 싶어 하는 몽골 사람들이 증가함에 따라 한국어를 가르치는 몽골 대학교 및 한국어 학원, 초?중?고등학교의 수가 늘어나고 있다. 한편, 최근 한국어 교육의 필요성과 중요성에 대한 관심이 여러 연구에 이어지고 있으나 어휘 교육, 그 중 유의어 교육에 관한 연구는 미비한 실정이다. 유의어는 발음이 다르지만 의미가 같거나 비슷한 어휘를 말하는데 몽골인 한국어 학습자들이 유의어를 이해하지 못하여 일으키는 오류는 의사소통에 장애를 발생시키기도 한다. 따라서 유의어를 분석하여 효과적으로 교육하는 방법을 제시하는 것이 몽골인 한국어 학습자의 원활한 의사소통 능력 신장에 도움이 될 수 있을 것이다. 따라서 본 연구에서는 크게 다음과 같은 단계로 연구를 진행하고자 한다. 첫째, 한국어 유의어 사전과 유의어 기존 자료들 등을 바탕으로 한 한국어 유의어 학습 목록을 추출하고, 그것을 몽골의 대표적인 한국어 학습 기관인 몽골국립대학교 및 몽골인문대학교의 한국어 학과에서 사용하는 한국어 교재에 나타난 유의어와 한국어능력시험의 기출문제에 나타난 유의어 목록과 비교하여 최종적으로 한국어 유의어 학습 목록을 추출한다. 몽골인 한국어 학습자는 비한자문화권 학습자이고, 영어보다 러시어가 친근하기 때문에 학습 단계가 올라갈수록 한국어 어휘 습득에 어려움을 겪는다. 그래서 어휘, 그 중 유의어 학습을 개선할 수 있는 방법으로 학습자 및 교사를 위한 유의어 목록을 제시하는 것이 시급하다고 판단하였다. 외국어를 학습할 때 기본 문법이나 어휘를 배우는 것도 중요하지만 학습자들이 초급 단계에서 중·고급 단계로 올라갈수록 어휘의 의미 차이를 이해하여 상황에 적합한 어휘를 사용해 보다 유창하고 정확하게 의미를 전달하는 것이 중요하기 때문이다. 그래야 자신을 표현하고 상대방의 의도를 이해할 수 있는 전문적인 인재로 발전할 수 있다. 둘째, 몽골인 한국어 학습자를 위한 TV 방송 프로그램을 활용한 효과적인 한국어 유의어 교육 방안을 제시하고자 한다. 몽골의 한류 열풍은 다른 아시아 국가들과 마찬가지로 강하게 일어나고 있다. 1999년에 처음으로 한국 드라마가 방영된 지 벌써 10여 년이 넘었지만 아직도 한국 드라마를 선호하는 몽골 사람들이 많고 시청률도 높은 편이다. 뿐만 아니라 한국 드라마에 이어 한국 영화, 대중음악, 토크쇼 등에 관심을 가지게 된 몽골 젊은이들이 점점 증가하고 있고 이는 한국에 대한 관심과 한국어에 대한 흥미로 이어지고 있다. 그러므로 효과적인 한국어 유의어 교육을 하기 위하여 몽골에서도 불고 있는 한류 문화 콘텐츠 중 TV 방송 프로그램을 이용하는 것이 적절한 방법이라고 본다. TV 방송 프로그램은 인쇄 매체보다 시각적, 청각적인 장점이 있으므로 학습자들의 흥미를 유발하게 하여 의사소통 능력을 통합으로 신장시킬수 있기 때문이다. 한국어를 배우고 나서 한국에 유학 가고 싶어 하는 몽골 청소년들이 급증하고 있는 이 시기에 한국어를 가르치는 대학교에서 학습자들의 눈높이에 맞추어 교육하는 것이 중요하기 때문에 TV 방송 프로그램을 활용한 한국어 유의어 교육 방안을 모색하는 것이 다방면에서 유용하다고 본다.문제중심학습"
몽골과 한국의 초 중등 교육제도 비교,"간치멕, 차희영",2017,"이 연구는 몽골과 한국의 교육적 교류를 발전시키는데 필요한 기초 자료를 확보하기 위한 목적으로 몽골과 한국의 교육제도를 비교、분석한 연구다. 연구를 위해 두 나라의 교육 관련 문헌 자료를 조사하여 비교했다. 먼저 몽골과 한국 사회의 역사적인 변천과정에서 교육 제도가 어떻게 변화되어 왔는지를 알아보았고, 두 나라의 현행 교육 제도를 분석하여 비교해 보았으며, 향후 양국의 교육 제도 개선에 대한 시사점을 도출하였다. 연구 결과, 몽골 교육은 구소련식 교육 제도로부터 영향을 받아 발전해왔고, 한국 교육은 미국식 교육 제도로부터 영향을 받아 오늘날까지 발전해 왔다. 몽골과 한국의 현행 학제도 각각 5-4-3제와 6-3-3제로 차이가 있었다. 학교 운영 방식도 단일형 학교 제도를 근간으로 하는 한국과는 달리 인구 밀도가 낮은 몽골은 통합형 학교 제도로 운영하고 있었다. 교육과정 편성 및 운영시간에서도 차이가 나타났는데, 몽골이 한국보다 연간 수업시수가 더 적었다. 연구 결과들은 기존에 한국에 많이 소개된 바 없는 몽골의 교육 제도에 관한 정보를 한국에 제공해 줄 것이며, 몽골에는 향후 교육 제도의 개선을 위한 참고 자료가 될 것이다.문제중심학습"
몽골과 한국의 초·중등학교 교육제도 및 과학과 교육과정의 목표와 내용 비교 분석,간투머 간치맥,2018,"본 연구는 몽골과 한국의 초·중등학교 교육제도 및 과학과 교육과정의 목표와 내용을 비교·분석하여, 양 국가의 교육제도 및 과학과 교육과정 개선에 필요한 기초 자료를 마련하고자 하였다. 교육제도를 비교하기 위한 분석 자료로 양 국가의 교육제도 관련 논문, 책, 단행본, 연구 보고서 등을 활용하여, 양 국가의 교육제도 변천사 및 현행 교육제도를 비교·분석하였다. 양 국가의 현행 교육제도 비교·분석에서는 ‘학제’, ‘학교 운영제도’, ‘연간 교육 계획’ 등을 비교·분석하였다. 그리고 과학과 교육과정 비교·분석에서는 양 국가의 과학과 교육과정의 목표 및 내용을 비교하였다. 과학과 교육과정의 ‘목표’ 분석을 위한 분석틀로는 Yager의 ‘과학교육 목표의 핵심 영역 준거’를 활용하였고, 과학과 교육과정 ‘내용’ 분석에는 ‘TIMSS 2015’의 내용 영역을 활용하여 양 국가의 과학과 교육과정의 내용을 비교·분석하였다. 연구 결과 몽골과 한국 양국의 교육제도는 상반된 이념으로부터 영향을 받아 근대 교육으로 변화해운 것으로 밝혀졌다. 몽골은 구소련의 영향으로 ‘사회주의 교육’ 이념으로부터, 한국은 미국의 영향으로 ‘민주주의 교육’ 이념의 영향을 받아 발전해왔다. 그리고 몽골은 1990년에 민주주의 국가로 체제를 전환하였고, 현재 몽골은 세계 흐름에 맞는 교육제도로 전환 중에 있다. 몽골은 1940년부터 2004년까지 10(4-4-2)년제 학제였고, 2008년에 12년제(5-4-3)로 개편하였다. 반면, 한국은 1951년에 12(6-3-3)년제 학제를 도입하여 현재까지 유지하고 있다. 몽골과 한국 양국의 과학과 교육과정 비교·분석에서 가장 차이가 큰 교과목은 지구과학 교과목이었다. 몽골은 ‘지구과학’이라는 교과목이 없으며, 대신에 ‘지리’ 교과를 과학 교과로 배운다. 몽골의 지리 교과는 지리 내용 뿐 만 아니라 지구과학 내용도 포함되어 있는 교과목이다. 반면, 한국은 지구과학과 지리 교과가 따로 있는데, 지구과학은 과학과에서, 지리는 사회과에서 다룬다. ‘TIMSS 2015’ 평가 목표를 통한 몽골과 한국의 과학과 교육과정 내용 분석 결과 물리, 화학, 생명과학, 지구과학 네 개 영역 중에서 물리 및 화학 영역이 몽골과 한국의 과학과 교육과정 내용과 높은 일치성을 보였다. 생명과학 및 지구과학 영역은 물리 및 화학 영역에 비해 낮은 일치성을 보였다. 물리 및 화학 영역 내용은 과학의 기본 개념과 원리를 다루기 때문에 전 세계적으로 큰 차이가 없어 보인다. 생명과학 영역의 경우 ‘TIMSS 2015’ 평가 목표에서 ‘건강’ 관련 내용이 포함되어 있는데 몽골과 한국의 과학과 교육과정 생명과학 영역에는 TIMSS에서 제시하고 있는 건강 관련 내용이 나타나지 않았다. 그 이유는 몽골은 건강 관련 내용을 생명과학에서 다루지 않고 ‘보건 교육’이라는 교과에서 따로 다루고 있고, 한국의 경우 체육 등의 다른 교과에서 다루기 때문이다. 지구과학 영역의 경우 몽골은 지구과학이라는 교과 자체가 없으며, 지리 교과 내에 포함돼 있다. 즉, 몽골 지구과학 관련 내용의 분량 자체가 적어 TIMSS 2015 평가 목표와 낮은 일치성을 보였다. 본 연구 결과는 양 국가의 교육 제도 및 과학교육과정 개선에 활용될 수 있을 것으로 기대된다. 또한 교육과정 국제 비교 연구 및 몽골과 한국의 교육 관련 비교 연구의 기초 자료로도 활용될 수 있을 것이다.문제중심학습"
