p_name,author,p_year,abstract
어윤치미크에게 말 걸기- 한 몽골 여성과의 만남을 통해 본 다문화교육 -,서덕희,2007,"나는 이 글에서 한 몽골 여성과의 만남에서 촉발된 선입견의 개방이 어떠한 과정을 거치는지 나의 체험을 중심으로 기술하고, 분석?해석함으로써 다문화교육을 ‘계획’이 아니라 ‘체험’으로 이해하고자 하였다. ‘계획’으로서의 다문화교육은 다문화적 상황 속에 처해 있는 바로 그 사람들의 체험과 관계에 대한 이해에 관심을 가지기보다는, 다문화교육이라는 교육과정의 투입-산출에만 관심을 기울이기 쉽다. 나는 이런 관점에서 관광이라는 다문화적 상황에서의 나의 체험에 주목하여 관광가이드인 한 몽골 여성과의 관계에 대한 이해의 과정을 교육의 관점에서 이해해보고자 하였다. 그 결과 ‘체험’으로서의 다문화교육은 다문화적 상황에서의 자신의 체험을 맥락화하는 과정에서 선입견이 생성되고 깨어지는 과정을 비판적으로 분석하고, 그들과의 중복된 체험 속에서 그들과 자신이 서로 같지 않지만 또 다르지도 않다는 것을 깨달아 나가는 과정임을 알게 되었다. 다문화적 상황이 국민국가, 종교, 인종, 성, 연령, 장애뿐만 아니라 문화 간 차이를 인지하는 당사자의 안목에 의하여 존재한다고 본다면, 다문화교육은 일상 속에서 상존할 수밖에 없는 객체화, 전체화 혹은 지배문화의 미시권력 행사에서 벗어나 공감과 연대의 힘을 키우는 삶의 형식이라고 말할 수 있다.문제중심학습"
몽골출신 결혼이주여성의 진로경험에 관한 연구,"알기르마, 김영순, 박미숙",2015,"본 연구의 목적은 몽골출신 결혼이주여성의 진로개발에 영향을 주는 요인을 탐색하고 결혼이주여성들의 진로개발 방안을 제시하는 것이다. 이를 위해 몽골출신 결혼이주여성 9명을 대상으로 2013년 8월부터 2014년 5월까지 심층인터뷰를 실시하였다. 인터뷰내용은 크럼볼츠(Klumboltz)의 사회학습이론에서 제시하는 진로결정요인 4가지, 즉 유전적 재능과 특별한 능력 요인, 환경적 조건과 사건 요인, 학습경험요인, 과제접근기술 요인으로 질문지를 구성하고 심층 인터뷰를 통하여 내용을 분석하였다. 연구결과 첫째, 몽골인은 한국인과 외모가 비슷하고 동양적인 사고를 가지고 있는 것과 몽골인의 특성인 진취적이고 빠른 적응이 한국 사회에서 진로를 선택하는데 많은 도움이 되었다. 둘째, 다문화사회로 접어든 한국사회가 다양한 다문화정책과 다문화관련 프로그램이 다문화관련 직업을 선택할 수 있게 되었다. 그러나 다문화 관련 직업이 장기적이거나 비젼을 가질 수 없는 현실이 안타깝다고 하였다. 셋째, 몽골출신 결혼이주여성은 한국어 능력과 모국에서의 학습경험이 진로를 결정하는데 영향을 주고 있었다. 그러나 모국에서의 경험이나 자격을 인정받지 못할 때에는 다른 직업을 선택할 수밖에 없다고 하였다. 넷째, 다양한 교육프로그램에 참여하고 제공받으면서 미래를 대처할 수 있는 자신의 능력을 향상시키고 있었으며 자원봉사 등 사회활동이 자신의 진로개발에 도움이 되었다. 이를 바탕으로 결혼이주여성의 진로개발 방안을 제시하였다.문제중심학습"
한국 ? 몽골 전통문화를 활용한 다문화 가정의 상호문화교육콘텐츠 연구,양민정,2015,"본고에서는 한국과 몽골의 전통문화, 특히 전통혼례와 설. 추석(나담)의 대표 세시풍속을 활용한 다문화 가정의 상호문화교육콘텐츠를 제시하고자 하였다.1) Ⅱ장에서는 첫째, 한국. 몽골 문화의 역사적 관련성과 의미에 대해 살펴 보았다. 둘째, 양국 간 전통문화를 활용한 다문화 가정을 위한 상호문화교육 필요성에 대해 논의하였다. Ⅲ장에서는 한국. 몽골 전통문화 중 대표적 두 유형, 즉 전통혼례와 세시풍속(설. 추석-나담축제)의 특징에 대해 살펴보았다. Ⅳ장에서는 Ⅲ장의 두 유형의 전통문화를 공통점과 차이점 중심으로 비교 분석하였다. Ⅴ장에서는 Ⅳ장 논의를 근거로 한국. 몽골 구성원 가정을 위한 상호문화교육콘텐츠를 제시하였다. 본고는 민속학 분야의 학술적 전공 연구는 아니다. 한국과 몽골과의 교류, 특히 몽골 여성의 결혼 이주 현황이 급증하면서 보다 긍정적이고 바람직한 다문화 가정으로의 정착, 나아가서는 한국형 다문화 구성원의 사회통합에 기여할 수 있는 상호문화교육콘텐츠를 제시하고자 시도되었다. 논의를 위해 양국 간 전통문화를 활용하였다. 본고는 한국. 몽골 간 전통문화 분석을 통하여 정주문화 및 유목민문화의 사유방식을 이해할 수 있는 기초를 마련한 연구의의도 있다고 본다. 나아가 다문화 가정 구성원의 실질적인 상호이해와 소통에 실질적, 교육적 자원으로 활용될 수 있을 것으로 기대한다.문제중심학습"
재한 몽골 유학생의 중도 탈락 경험에 관한 질적 연구,"양징르함, 김사훈",2019,"본 연구의 목적은 한국 고등교육 기관에서 교육을 이수하고 있는 유학생들의 중도 탈락 현상의 원인을 심층적으로 분석하기 위함에 있다. 이를 위하여 Tinto(1975)의 상호작용 모형을 이론적 분석틀로 활용하여 명의 연구참여자들의 면담을 분석하였다. 연구 참여자들의 중도탈락은 학업적, 사회적 통합의 어려움으로부터 비롯되고 있는데, 구체적으로 어떠한 어려움이 있었는지, 어떠한 경험과 부적응이 학생의 중도 탈락의 결정적 계기가 되는지를 살펴보았다. 이 결과, 본국에서보다 현저하게 낮아진 자신의 학업 성취 결과를 감수하기, 상호작용의 부재로 인한 고립감, 한국어 장벽 외에도 느껴지는 영어 장벽, 취직 관련 희망이 없는 유학 생활이라는 인식 등이 중도탈락을 하게 되는 결정적 원인이 되고 있었다. 이러한 측면에서 봤을 때 중도 탈락에 관한 결정은 자의적 결정이라고만 간주하기는 어렵다. 대학, 사회, 유학생의 미래 진로 등에 대한 성공적인 연결 고리가 유기적으로 이어질 때, 유학생은 안정적인 학업 생활을 계속해갈 수 있을 것이다.문제중심학습"
몽골 대학의 한국어 교재에 나타난 유의어 분석,에르덴수랭,2013,"외국어를 학습할 때 기본 문법이나 어휘를 배우는 것이 중요하지만 학습자들이 초급 단계에서 중, 고급 단계로 올라갈수록 상황에 적합한 어휘를 사용하고 보다 정확하게 그 의미의 차이를 이해하는 것이 중요하다. 그리하여야 자신이 전달하고자 하는 의미를 정확하게 표현하고 상대방의 의도를 이해할 수 있는 전문적인 인재로 발전할 수 있기 때문이다. 특히 몽골인 학습자들의 특징은 비한자문화권 한국어 학습자고 또한, 영어보다 러시어가 가까운 이유로 학습 단계가 올라갈수록 어휘 교육에 어려움을 겪고 있다. 그래서 어휘 중 유의어 학습을 개선 할 수 있는 방법으로 학습자 및 교사를 위한 유의어 쌍 목록집을 제시하는 것이 효과적이라고 판단하였다. 이번 연구는 몽골인 한국어 학습자와 교사를 위한 교육용 기본 유의어 쌍 목록집을 제시하기 위하여 한국어 연구의 주 자료들을 통하여 한국어 교육용 기본 유의어 쌍 추출 목록을 선정하고 몽골에서 대표적인 몽골국립대학교 및 몽골인문대학교의 한국어 학과에서 사용하는 한국어 교재에 나타난 유의어를 분석하였다. 그래서 몽골인 학습자를 위한 교육용 한국어 기본 유의어 쌍 목록 선정 및 몽골대학교 한국어 학과에서 사용하는 교재의 색인 부분에 없지만 한국어교육용 기본 유의어 추출 목록에는 존재하는 유의어 쌍 중 선별하여 몽골인 학습자를 위한 한국어 교육용 기본 유의어 쌍 보완 추출 목록을 선정하였다. 그 결과 명사유의어 460쌍(43.9%), 동사유의어 354쌍(33.6%), 형용사유의어 136쌍(12.9%), 부사유의어 101쌍(9.6%)으로 총 1051쌍을 추출하였다. 단계별로 보면 초급 단계 154쌍(14.6%), 중급 단계 353쌍(33.5%), 고급 단계 546쌍(51.9%)으로 구성하여 선정하였다.문제중심학습"
몽골의 통·번역 전공 한국어 교육과정에 대한 비판적 검토- 몽골국립과학기술대학교의 사례를 중심으로,"엥크체첵, 김영란",2017,"최근 몽골에서의 한국어교육 목적은 학습자의 요구에 따라 일반적 의사소통이 아닌 통·번역 능력 향상으로 고도화되었다. 이에 따라 몽골국립과학기술대학교는 교육 목표와 교육과정을 개정한바, 과학·기술 분야에서 통·번역이 가능한 인재 양성을 지향하고 있다. 그러나 이러한 변화의 과정에서 교육 목표에 따른 교육과정 및 그에 따른 교재 선정 측면에서 여러 보완해야 할 문제를 안고 있다. 이에 우리는 현재 몽골과기대의 한국어 교육과정을 비판적으로 검토하고, 주어진 여건 내에게 보완할 수 있는 지점을 제안하고자 한다. 우선 몽골과기대의 한국어 교육과정은 문법과 구어 교육에 상당히 치중하고 있는 바, 학습자가 과학·기술적 문식능력을 향상하는 데 어려움을 겪고 있다. 향후 과학·기술 분야를 다루는 언어 능력과 문어 능력을 신장하는 교육과정으로 보완하기 위해 새로운 교과목 설정을 제안하였다. 그리고 일부 위계성이 결여된 교과목의 개설 시기를 수정할 것을 제언하였고, 한국어 구어와 문어, 과학·기술 분야의 특화된 언어 능력을 고루 신장할 수 있도록 수업 시수 조정이 필요하다. 마지막으로 최근 몽골 학습자용 교과서가 개발된바, 현재 활용되고 있는 일부 교재 변경을 제언하였다.문제중심학습"
한국과 몽골의 역사문화유산을 활용한 학습방안 구축,오일환,2012,우리나라에는 몽골의 영향을 받은 역사문화유산과 생활민속이 다양하게 남아있다. 그러나 한?몽 간의 국제문화 이해를 위하여 역사적 시각자료를 활용한 학습방안 및 콘텐츠 구축에 대한 연구는 매우 중요한 과제이지만 오늘날 한?몽 관계의 한계와 현실 속에서 연구가 부족한 실정이다. 본 연구는 이러한 인식에서 우리나라와 몽골의 역사문화 유적을 활용한 문화사적 융복합의 학습방안을 구축하고자 하였다. 연구방법으로는 한?몽 간의 역사문화를 이해하기 위하여 7차 교육과정과 2009 개정 교육 과정의 국내 중학교와 고등학교의 역사와 사회 교과서에 나타난 몽골인식과 박물관을 비롯한 문화기관의 전시현황을 분석하였다. 이를 바탕으로 국내의 몽골 역사문화유산과 생활민속 자료를 활용한 문화사적 학습방안 및 몽골지역의 문화유산과 자연환경을 활용한 몽골이해 학습방안을 구축하였다. 연구결과로 한?몽 간의 역사적 인식과 문화적 교류를 증진하기 위해 국내에 남아있는 몽골 영향의 역사문화유산에 대하여도 세계사적 시각에서 학습 자료화하여 활용하는 방안을 제시하였다. 이러한 한?몽 간의 역사문화유산을 통한 문화사적 융복합의 학습방안은 교과 교육과정의 학생이나 일반인을 대상으로 국제문화의 특징을 이해하는 시각적 학습 뿐 아니라 양국을 이해하는 인문학적 연구의 기초로 활용할 수 있다.문제중심학습
몽골의 ‘항가이’지역의 단위학교 학교운영비 배분 결정요인 분석,"을지새항, 천세영, 김수구",2011,"이 연구는 교육재정 배분에 있어 중앙집권적인 특성이 강한 몽골의 교육재정배분에서 발생하는 다양한 문제점을 해소하고, 단위학교를 운영하는데 있어서 효과적인 재정배분을 하기 위한 방안으로 학교재정배분의 결정 요인을 찾고, 이러한 요인들로 단위학교 재정배분에 적용될 수 있는 포뮬러 펀딩 모델을 제시하고자 하였다. 연구 결과의 도출을 위하여 문헌연구를 통하여 몽골의 단위학교 학교운영비 배분을 결정하는 결정요인을 설정하였으며, 몽골의 ‘항가이‘지역의단위학교를연구대상으로하여10년제와12년제학교결산서를 초등과정 및 중등과정으로 분리하여 단위학교 결산서에 나타난 학교운영비를 종속변인으로, 이 연구에서 설정한 학교운영비 결정요인을 독립변인으로 설정하여 중다회귀 분석을 실시여 포뮬러 펀딩 모델을 개발하였다. 이 연구에서 제시된 포뮬러 펀딩 모델 결과는 첫째, 초등학교는 학생당 254,700?, 10년제 학교의 경우는 중학생당 275,624?, 중학교과정 5학급 미만인 학교의 경우 학교당 9,294,972?이 더 배분 되어야 하며. 12년제 학교의 경우 중?고학생당 189,946?, 도시 이외 지역의 학교인 경우 학교당 14,760,660?이 더 배분될 필요가 있는 것으로 나타났다.문제중심학습"
이주근로자 가정의 사회적 관계망과 자녀교육 기획: 몽골학교 학부모들의 학교선택과 그 의미화를 중심으로,"이민경, 김경근",2012,"이 연구는 가족이주의 특성이 두드러지는 몽골 이주근로자 가정 학부모들이 한국사회에서 체류하는 동안 어떻게 자녀교육을 기획하고 실천하며 의미화 하는지를 그들이 맺는 사회적 관계망과의 연관 속에서 탐구한 것이다. 구체적으로, 이 연구는 몽골 이주근로자 가정의 사회적 관계망이 한국사회 정착 과정에 어떻게 영향을 미치며, 어떤 과정을 통해 자녀교육 기획으로 연결되는지, 그리고 자녀교육 기획과 실천이 어떻게 다시 새로운 사회적 관계망 형성과 연결되는지 분석하였다. 연구 결과, 몽골학교 학부모들이 한국에서 자녀교육 공간으로 몽골학교를 선택하는 사례는 적극적 선택과 소극적 선택으로 나눌 수 있었다. 적극적 선택은 자녀교육 계획과 향후 진로 등을 고려하여 의도적으로 자녀를 한국의 일반학교에 보내지않고 몽골학교로 취학시키는 경우이고, 소극적 선택은 한국의 일반학교에 자녀를 보내고 싶지만 취약한 정보력, 부모의 신분노출 위험, 자녀의 부적응에 대한 두려움 등의 이유 때문에 차선책으로 몽골학교에 자녀를 취학시키는 경우라고 할 수 있다. 이 같은 분석 결과를 바탕으로 후속 연구의 필요성과 정책적 시사점을 제시하였다.문제중심학습"
노동-유학-자녀교육의 동맹: 몽골 이주노동자 가정의 이주ㆍ정착ㆍ귀환의 행위자 네트워크(ANT),이민경,2015,"이 논문은 몽골 이주노동자 가정의 한국으로의 이주, 정착과 귀환으로 이어지는 이주의 순환과정을 자녀교육을 둘러싼 행위자 네트워크 이론(Actor-Network Theory:ANT)으로 분석한 것이다. 일반적으로 이주노동자의 이동은 경제적 목적을 위해 국경을 넘는 ‘노동력’의 이동으로 인지된다. 그러나 이주노동자의 이동은 이주 당사자의 개인적 삶의 선택의 문제인 동시에 국가간 관계, 각국의 사회문화적 환경 등 다양한 인간ㆍ비인간 행위자들이 개입되는 복합적 과정이다. 행위자 네트워크 이론(ANT)은 이주노동자를 세계화의 수동적인 행위자로 이해했던 기존의 연구틀을 벗어나 이들의 이주와 정착 혹은 귀환의 과정을 송출국과 정착국의 관계, 관련 정책과 제도 등과 상호교차하면서 자신들의 삶을 기획하는 적극적인 행위자로 바라봄으로써 연구의 외연을 확장하고 깊이를 심화시킬 수 있는 가능성을 제시한다. 이 연구는 몽골 이주노동자가 자녀를 동반하는 한국사회 최대 이주노동자 집단이라는 점에 주목하여 이들의 이동을 자녀교육과의 연관 속에서 다양한 행위자들이 개입하는 복합적인 과정으로 파악하고자 하였다. 이를 위해 한국사회에서 자녀를 동반하면 살고 있는 몽골 이주노동자들과 재한 몽골학교 현장전문가를 심층 인터뷰하여 이들의 이주와 정착, 귀환과정을 행위자네트워크에 의해 탐구하였다. 이를 통해 한국 사회에서 ‘이주노동자’라는 호명이 블랙박스(black box)로 작동함으로써 드러나지 못하는 자녀교육을 둘러싼 몽골 이주노동자 가정의 다양한 삶의 과정과 경험을 다층적으로 분석하였다.문제중심학습"
팀 프로젝트 기반 환경주제 사회문제해결 프로그램 참여 대학생들의 환경 인식 변화 연구: 한국·몽골 대학생 중심으로,"이윤선, 고명희, 김재선, 김수영",2019,"본 연구의 목적은 한국과 몽골 대학생을 대상으로 팀 프로젝트 기반 환경주제 사회문제해결 프로그램을 실행하고 참여한 대학생의 환경에 대한 인식 변화를 고찰하는 것이다. 프로그램은 한국과 몽골 교수진이 공동으로 개발하여 내용전문가의 자문을 받아 최종 정리하였고, 개발된 프로그램은 2017년 서울소재 S대학교에서 교양 필수 과목인 환경주제 사회문제 해결수업 수강생 34명과 환경주제 사회문제 해결 동아리 활동을 한 울란바토르시 소재 U대학교 학생 12명에게 실행하였다. 프로그램 진행과정에서 수집된 두 성찰일지를 분석한 결과, 대학생들은 환경에 대한 지식 및 이해, 태도 및 가치관, 기술, 그리고 실천적 의지 측면의 변화를 경험하였다고 보고하였다. 특히, 환경에 대한 지식 습득 및 생태학적 관점에서 환경을 바라보는 관점의 변화, 환경문제에 대한 책임의식, 연대의식, 협동, 존중과 배려 등의 태도, 가치관 및 기술의 변화, 그리고 환경문제를 해결하기 위한 일상에서의 실천의지를 포함하는 통합적인 교육효과가 있었다고 한다. 특히, 학생들은 팀 프로젝트 수업에서 자신의 의견을 나누고 동료학생들의 말을 경청하는 토의활동을 통해 공감적 의사소통능력이 향상되었다고 보고하였다. 한국과 몽골 대학생들이 같은 학기에 동일한 환경 프로젝트를 진행함으로써, 환경문제가 세계적 문제이며 세계 모든 사람들이 책임감을 가지고 함께 해결해야한다는 글로벌시민의식 함양에도 긍정적 영향을 미쳤다.문제중심학습"
몽골 해외봉사자를 위한 유아 수학교육 프로그램 개발에 관한 연구,"이소정, 이정욱",2013,"본 연구는 몽골에 파견된 해외봉사자가 효율적인 수학교육을 실시할 수 있도록 지원하는 유아 수학교육 프로그램을 개발하는데 목적이 있다. 연구방법은 개입연구(Interventim Research)를 토대로 하여 개입연구의 '보급’단계를 제외한 5단계에 따라 몽골 해외봉사자를 위한 유아? 수학교육 프로그램을 최종 구성하였다. 연구결과，몽골 해외봉사자의 면담조사와 현장조사 결과를 근거로 '개입 구성요소’와 ‘개발 원칙’을 개발하였으며 몽골 유치원 예비반 수학교육과정과 그룹 게임에 대한 정보를 수집하고 통합하여 16개의 회기별 프로그램과 초기 프로그램 그리고 후기 프로그램의 개발 단계를 거쳐 몽골 유치원 예비반 수학교육과정의 ‘수와 연산’, ‘공간과 기하’의 수학적 요소를 포함한 28개 그룹게임의 교육활동으로 구성된 유아 수학교육 프로그램을 최종 구성하였다. 본 연구롤 통해 몽골 해외봉사자의 실천 현장과 연관성 있는 깨입’을 개발하고 몽골 유아교육 현장과 몽골 해외봉자사의 여건에 적합한 교육올 실시할 수 있도록 지원하며, 몽골 해외봉사자의 어려움을 극복할 수 있는 방법을 모색하여 몽골 해외붕사자 효율적으로 교육 활동을 실시할 수 있도록 해야 함을 알 수 있었다. 따라서 해외봉사자의 유아교육 봉사활동 실천 현장에 대한 정보나 자료를 확보하는 것，해외봉사자의 유아교육 봉사활동올 지속적으로 지원할 수 있는 프로그램을 개발하고 활용하는 것, 이를 위해 유아교육 전문 인력을 개발하고 전문 인력을 참여시키려는 노력이 필요함을 제언하고자 한다.문제중심학습"
